{
  "$schema": "https://json-schema.org/draft/2020-12/schema",
  "$id": "urn:graft:schema:scion:0.2.0",
  "$comment": "SPDX-License-Identifier: Apache-2.0",
  "title": "graft scion",
  "description": "A named variant with optional parent and ordered layer opinions.",
  "type": "object",
  "additionalProperties": false,
  "required": ["graft", "id", "concept", "dest", "layers"],
  "properties": {
    "graft": { "const": "0.2.0" },
    "id": { "type": "string", "minLength": 1 },
    "concept": {
      "type": "string",
      "pattern": "^[0-9a-f]{8}-[0-9a-f]{4}-[0-9a-f]{4}-[0-9a-f]{4}-[0-9a-f]{12}$"
    },
    "parent": { "type": "string", "minLength": 1 },
    "change_request": {
      "type": "object",
      "additionalProperties": false,
      "required": ["feedback", "slots"],
      "properties": {
        "feedback": { "type": "string", "minLength": 1 },
        "slots": {
          "type": "array",
          "minItems": 1,
          "uniqueItems": true,
          "items": { "type": "string", "pattern": "^[a-z][a-z0-9_]*$" }
        }
      }
    },
    "dest": { "$ref": "#/$defs/dest" },
    "graph": { "$ref": "#/$defs/graph" },
    "layers": {
      "type": "array",
      "items": { "$ref": "#/$defs/layer" }
    }
  },
  "$defs": {
    "working": {
      "type": "object",
      "additionalProperties": false,
      "required": ["pix_fmt", "color"],
      "properties": {
        "pix_fmt": { "type": "string", "minLength": 1 },
        "color": { "type": "string", "minLength": 1 },
        "primaries": { "type": "string", "minLength": 1 },
        "trc": { "type": "string", "minLength": 1 }
      }
    },
    "graph": {
      "type": "object",
      "additionalProperties": false,
      "required": ["nodes"],
      "properties": {
        "mode": { "enum": ["append", "replace"], "default": "append" },
        "nodes": {
          "type": "array",
          "items": { "$ref": "#/$defs/graphNode" }
        }
      }
    },
    "graphNode": {
      "type": "object",
      "additionalProperties": false,
      "required": ["id", "op"],
      "properties": {
        "id": { "type": "string", "pattern": "^[A-Za-z#][A-Za-z0-9_#]*$" },
        "op": { "type": "string", "minLength": 1 },
        "inputs": {
          "type": "array",
          "items": { "type": "string", "minLength": 1 }
        },
        "material": { "$ref": "#/$defs/material" },
        "source": { "$ref": "#/$defs/timedRange" },
        "place": { "$ref": "#/$defs/range" },
        "enable": { "type": "string", "minLength": 1 },
        "role": { "type": "string", "minLength": 1 },
        "params": { "type": "object" },
        "keys": {
          "type": "object",
          "additionalProperties": {
            "type": "array",
            "minItems": 1,
            "items": { "$ref": "#/$defs/keyframe" }
          }
        },
        "nodes": {
          "type": "array",
          "items": { "$ref": "#/$defs/graphNode" }
        }
      }
    },
    "rate": {
      "type": "object",
      "additionalProperties": false,
      "required": ["num", "den"],
      "properties": {
        "num": { "type": "integer", "minimum": 1 },
        "den": { "type": "integer", "minimum": 1 }
      }
    },
    "range": {
      "type": "object",
      "additionalProperties": false,
      "required": ["start", "duration"],
      "properties": {
        "start": { "type": "integer", "minimum": 0 },
        "duration": { "type": "integer", "minimum": 1 }
      }
    },
    "timedRange": {
      "type": "object",
      "additionalProperties": false,
      "required": ["rate", "range"],
      "properties": {
        "rate": { "$ref": "#/$defs/rate" },
        "range": { "$ref": "#/$defs/range" }
      }
    },
    "material": {
      "type": "string",
      "pattern": "^blake3:[0-9a-f]{64}$"
    },
    "audioBinding": {
      "type": "object",
      "additionalProperties": false,
      "required": ["material", "source"],
      "properties": {
        "material": { "$ref": "#/$defs/material" },
        "source": { "$ref": "#/$defs/timedRange" },
        "place": { "$ref": "#/$defs/range" }
      }
    },
    "keyframe": {
      "type": "object",
      "additionalProperties": false,
      "required": ["t", "v"],
      "properties": {
        "t": { "type": "number", "minimum": 0 },
        "v": { "type": "number" },
        "ease": {
          "enum": ["hold", "linear", "ease_in", "ease_out", "ease_in_out"]
        }
      }
    },
    "motion": {
      "type": "object",
      "additionalProperties": false,
      "properties": {
        "x": { "type": "array", "items": { "$ref": "#/$defs/keyframe" } },
        "y": { "type": "array", "items": { "$ref": "#/$defs/keyframe" } },
        "opacity": { "type": "array", "items": { "$ref": "#/$defs/keyframe" } }
      }
    },
    "binding": {
      "type": "object",
      "additionalProperties": false,
      "required": ["material", "source"],
      "properties": {
        "material": { "$ref": "#/$defs/material" },
        "source": { "$ref": "#/$defs/timedRange" },
        "params": { "type": "object", "additionalProperties": true },
        "audio": { "$ref": "#/$defs/audioBinding" },
        "nested": { "type": "string", "minLength": 1 },
        "x": { "type": "string", "minLength": 1 },
        "y": { "type": "string", "minLength": 1 },
        "opacity": { "type": "number", "minimum": 0, "maximum": 1 },
        "motion": { "$ref": "#/$defs/motion" },
        "remap": {
          "type": "array",
          "items": { "$ref": "#/$defs/keyframe" }
        }
      }
    },
    "layer": {
      "type": "object",
      "additionalProperties": false,
      "required": ["name", "bindings"],
      "properties": {
        "name": { "enum": ["base", "copy", "grade", "legal"] },
        "bindings": {
          "type": "object",
          "additionalProperties": { "$ref": "#/$defs/binding" }
        }
      }
    },
    "dest": {
      "type": "object",
      "additionalProperties": false,
      "required": ["id", "width", "height", "rate", "pix_fmt", "color", "encoder"],
      "properties": {
        "id": { "type": "string", "minLength": 1 },
        "width": { "type": "integer", "minimum": 1 },
        "height": { "type": "integer", "minimum": 1 },
        "rate": { "$ref": "#/$defs/rate" },
        "pix_fmt": { "type": "string", "minLength": 1 },
        "color": { "type": "string", "minLength": 1 },
        "working": { "$ref": "#/$defs/working" },
        "encoder": { "$ref": "#/$defs/encoder" }
      }
    },
    "encoder": {
      "type": "object",
      "additionalProperties": false,
      "required": ["impl", "version", "keyint", "sc_threshold"],
      "properties": {
        "impl": { "type": "string", "minLength": 1 },
        "version": { "type": "string", "minLength": 1 },
        "profile": { "type": "string" },
        "level": { "type": "string" },
        "rate_control": {
          "type": "object",
          "additionalProperties": false,
          "required": ["mode"],
          "properties": {
            "mode": { "enum": ["crf", "bitrate"] },
            "crf": { "type": "number" },
            "bitrate": { "type": "string" }
          }
        },
        "preset": { "type": "string" },
        "keyint": { "type": "integer", "minimum": 1 },
        "sc_threshold": { "type": "integer", "const": 0 },
        "toolchain": { "type": "object", "additionalProperties": true }
      }
    }
  }
}
