{
  "graft": "0.2.0",
  "id": "hook_v3+body_v1+cta_v1@9x16",
  "concept": "6f8c2e14-9a71-4d3b-b0e6-1c4d8a7f92ab",
  "dest": {
    "id": "9x16",
    "width": 1080,
    "height": 1920,
    "rate": { "num": 30, "den": 1 },
    "pix_fmt": "yuv420p",
    "color": "bt709",
    "encoder": {
      "impl": "x264",
      "version": "r3222",
      "profile": "high",
      "level": "4.1",
      "rate_control": { "mode": "crf", "crf": 18 },
      "preset": "medium",
      "keyint": 30,
      "sc_threshold": 0
    }
  },
  "layers": [
    {
      "name": "base",
      "bindings": {
        "hook": {
          "material": "blake3:aaaaaaaaaaaaaaaaaaaaaaaaaaaaaaaaaaaaaaaaaaaaaaaaaaaaaaaaaaaaaaaa",
          "source": {
            "rate": { "num": 30, "den": 1 },
            "range": { "start": 12, "duration": 90 }
          },
          "params": { "speed": 1.0 }
        },
        "body": {
          "material": "blake3:bbbbbbbbbbbbbbbbbbbbbbbbbbbbbbbbbbbbbbbbbbbbbbbbbbbbbbbbbbbbbbbb",
          "source": {
            "rate": { "num": 30, "den": 1 },
            "range": { "start": 36, "duration": 510 }
          },
          "params": { "speed": 1.0 }
        },
        "cta": {
          "material": "blake3:cccccccccccccccccccccccccccccccccccccccccccccccccccccccccccccccc",
          "source": {
            "rate": { "num": 30, "den": 1 },
            "range": { "start": 0, "duration": 90 }
          },
          "params": { "speed": 1.0 }
        }
      }
    }
  ]
}
